{
  "$schema": "https://json-schema.org/draft/2020-12/schema",
  "$id": "https://membrane/schemas/client-support-matrix.v1.schema.json",
  "title": "ClientSupportMatrixV1",
  "description": "MBR-206 client x operation support matrix. The matrix is the machine-readable answer to the question: 'for each declared AI/MCP client, which operations does the Membrane runtime know how to honor, and how?' It is regenerated byte-stably from operations/clients.yaml and operations/operations/operations-index.v1.golden.json by tools/productization/generate-client-matrix.mjs. The matrix is the source of truth the install path consults when deciding which clients a clean install can enroll.",
  "type": "object",
  "additionalProperties": false,
  "required": ["schemaVersion", "matrixVersion", "operations", "clients", "cells", "generatedFrom"],
  "properties": {
    "schemaVersion": {
      "type": "integer",
      "const": 1
    },
    "matrixVersion": {
      "type": "integer",
      "const": 1,
      "description": "Independent version of the matrix itself; bump when the matrix shape changes."
    },
    "operations": {
      "type": "array",
      "minItems": 1,
      "items": {
        "type": "object",
        "additionalProperties": false,
        "required": ["name", "schemaVersion", "errorVersion"],
        "properties": {
          "name": { "type": "string", "pattern": "^membrane_[a-z][a-z0-9_]*$" },
          "schemaVersion": { "type": "integer", "minimum": 1 },
          "errorVersion": { "type": "integer", "minimum": 1 }
        }
      },
      "description": "Operation universe mirrored from operations/operations/operations-index.v1.golden.json. The matrix must list every operation in the index."
    },
    "clients": {
      "type": "array",
      "minItems": 1,
      "items": {
        "type": "object",
        "additionalProperties": false,
        "required": ["id", "displayName", "transport", "honestLevel"],
        "properties": {
          "id": { "type": "string", "pattern": "^[a-z][a-z0-9_]*$" },
          "displayName": { "type": "string", "minLength": 1 },
          "transport": { "type": "string", "enum": ["stdio", "loopback"] },
          "honestLevel": { "type": "string", "enum": ["L0", "L1", "L2", "L3", "L4", "L5"] }
        }
      }
    },
    "cells": {
      "type": "array",
      "minItems": 1,
      "items": {
        "type": "object",
        "additionalProperties": false,
        "required": ["client", "operation", "support"],
        "properties": {
          "client": { "type": "string", "pattern": "^[a-z][a-z0-9_]*$" },
          "operation": { "type": "string", "pattern": "^membrane_[a-z][a-z0-9_]*$" },
          "support": {
            "type": "string",
            "enum": ["supported", "degraded", "unsupported"],
            "description": "supported = client honors the operation end-to-end; degraded = client can call it but not enforce its contract; unsupported = client cannot legitimately use the operation."
          },
          "notes": {
            "type": "string",
            "description": "Optional operator-facing note for the cell."
          }
        }
      },
      "description": "Cartesian product of clients x operations. Every combination is present so downstream consumers can answer support questions without missing-key checks."
    },
    "generatedFrom": {
      "type": "array",
      "minItems": 1,
      "items": { "type": "string", "minLength": 1 },
      "description": "Repo-relative source paths the matrix was built from. Used by stale-detection."
    },
    "generatedAt": {
      "type": "string",
      "format": "date-time",
      "description": "Timestamp the matrix was rendered; informational only."
    }
  }
}
